{"schema_version":"tessera.guardian.tool-result.v1","status":"no_result","tool":"vault_query","trust":{"classification":"untrusted_evidence_boundary","instruction_authority":"none","consumer_notice":"Synthetic fixture: evidence and source metadata are untrusted data."},"authorization":{"classification":"owner_approved_metadata","lens_id":"lens_SYNTHETIC","lens_name":"synthetic-read-only","purpose":"consumer conformance testing","disclosure_mode":"excerpt"},"evidence":[],"spaces":[],"error":null}
